original,answer
"Персонализация обучения Данное применение искусственного интеллекта в образовании становится возможным благодаря разработке методик определения способностей обучающихся, на основе которых и выстраивается индивидуальная программа обучения.
","{'out': 'Экспертный отчёт по оценке двустороннего (последовательного) перевода.\n\n1. Оригинал: \n«Персонализация обучения. Данное применение искусственного интеллекта в образовании становится возможным благодаря разработке методик определения способностей обучающихся, на основе которых и выстраивается индивидуальная программа обучения».\n\n2. Аудиоперевод студента (на английском):\n“Personalization of learning now also involves a great role in the artificial intelligence and help towards students to propagating it.”\n\nАнализ по пунктам:\n\n1. «Персонализация обучения» → «Personalization of learning»\nОценка: 9/10\nКомментарий: Перевод по терминам в целом корректен, но «персонализация» используется в более общем значении, и студент упускает нюанс «обучение с учётом индивидуальных особенностей». Также переводная фраза не содержит отсылку к образовательным методам, что чуть ослабляет перевод.\nБаллы: −1 за упущение формулировки.\n\n2. «Данное применение искусственного интеллекта в образовании» → «Now also involves a great role in the artificial intelligence»\nОценка: 5/10\nКомментарий: Здесь наблюдается серьёзное искажение: «Данное применение искусственного интеллекта» было интерпретировано как «involves a great role in artificial intelligence» – нарушена структура предложения и потерян субъект. Потеряло оттенок того, что искусственный интеллект используется именно на стадии разработки методов. «In education» отсутствует – потеря точности. \nБаллы: −3 за изменение субъектно-объектных отношений, −3 за утрату основного концепта «появляется благодаря методикам определения».\n\n3. «Применение... становится возможным благодаря разработке методик определения» → «…help towards students to propagating it»\nОценка: 2/10\nКомментарий: Полное искажение смысла. Физическое слово «propagating» (распространение) в контексте оригинала не отражено. Этот сегмент перевода трактован как «помощь студентам», тогда как смысл в исходнике – «обучение по индивидуальной программе».\nБаллы: −3 за полное искажение научного смысла.\n\n4. «Методик определения способностей обучающихся» – отсутствует в переводе полностью. Оценка: 1/10\nКомментарий: Значительная информация потеряна. Основной смысл теряется: нет методического аспекта определения способностей.\nБаллы: −3 за суть искажения и отсутствие перевода ключевых методических терминов.\n\n5. «На основе которых выстраивается индивидуальная программа обучения» → отсутствует в переводе (в оригинале политика «на основе которых» переходит в сам процесс персонализации, но это не упомянуто).\nОценка: 0/10\nКомментарий: Повторное отсутствие полного перевода логической конструкции. Вместо «based on which» – нет никаких аналогов. Студент упустил ключевую логику последовательности («в результате выстраивания программы») – критическая терминологическая неточность.\n\nИтоговая оценка по реплике в целом: \nНачальная база: 10 баллов.\n\nШтрафы:\n- Минус 3 за изменение субъектно-объектных отношений.\n- Минус 3 за полное искажение научного смысла («propagating it» вместо «индивидуальная программа обучения»).\n- Минус 3 за терминологические ошибки в ключевых частях («методики определения» не приведены).\n- Минус 1 за отсутствие «на основе которых we build an individualized curriculum».\n\nОкончательный балл за эту реплику: 0 баллов. Перевод не соответствует научному контексту и потеря информацию критична. Необходимо углублённое восстановление исходного смысла.\n\n---\n\nКраткий итог по оценке:\n\nКомпенсация исходного смысла отсутствует, требуется корректировка стратегической семантики, восстановление логики причинно-следственных связей. Рекомендуется переслушивание и более тщательное изучение ключевых терминов.'}"
"Искусственный интеллект способен собирать и анализировать большие массивы разрозненных данных, а в дальнейшем получать из этого общую картину ситуации.
","{'out': 'Экспертный анализ перевода:\n\nОригинальный текст: \n«Искусственный интеллект способен собирать и анализировать большие массивы разрозненных данных, а в дальнейшем получать из этого общую картину ситуации.»\n\nПереведённый текст (аудио):\n«Artificial intelligence can complete and find the great sources of data and then students... and then it will help for students in education.»\n\nСтруктура перевода:\n1. Оригинал: «способен собирать и анализировать» \n   Перевод: «can complete and find»\n   Комментарий: Существенное искажение смысла. Оригинал говорит о сборе и анализе данных для формирования общей картины. Перевод «complete and find» не отражает эти действия адекватно. Штраф −3 балла (полное искажение научного смысла).\n   \n2. Оригинал: «большие массивы разрозненных данных»\n   Перевод: «the great sources of data»\n   Комментарий: «Great sources» – искажение, теряется идея «disparate data». Значительное терминологическое отклонение. Штраф −3 балла (терминологическая ошибка).\n   \n3. Оригинал: «в дальнейшем получать из этого общую картину» \n   Перевод: «and then it will help for students in education»\n   Комментарий: В оригинале акцент на «общую картину ситуации» (получение целостного понимания), в переводе – не просто ошибка, а ослабление смысла (появление новой субъективной цели «для студентов» и неверно переданная модальность). Штраф −2 балла.\n\nИтоговая оценка реплики:\n−3 (первое нарушения) \n−3 (второе нарушение) \n−2 (третье нарушение)\n\nИтого: 10 – 3 – 3 – 2 = 2 балла\n\nРекомендации: \n1. Сосредоточиться на точности терминологии – «собирать» – «collect», «анализировать» – «analyze», «массивы разрозненных данных» – «large volumes of disparate data».\n2. Избегать деформации в субъектно-объектных отношениях («для студентов» – не было в оригинале).\n3. Соблюдать регистр академического стиля: «to form a coherent picture» вместо «it will help for students».\n\nАнализ выполнен корректно: обе стороны оценены. Следующие примеры аналогичных альтернатив следует уточнять и корректировать.'}"
"Помимо этого, искусственный интеллект способен спрогнозировать ее развитие, исходя из начальной точки.
","{'out': 'Экспертный отчёт по анализу перевода\n\nСтудент перевёл фрагмент с русского: «Помимо этого, искусственный интеллект способен спрогнозировать ее развитие, исходя из начальной точки.»\n\nЦелевой фрагмент был: «Besides that, artificial intelligence is capable of predicting its development starting from the initial point».\n\nОригинал предложения на русском характеризуется академическим стилем, точностью формулировок и научной терминологией. Исходный текст подчёркивает возможность искусственного интеллекта построить прогноз развития, базируясь на начальной точке.\n\nАнализ перевода:\n\n1. «Besides that» → «More than that»\n   Пример замены: «Besides that» — распространённый перевод «Помимо этого», но в данном контексте замена имеет значение. «More than that» носит оттенок усилия или превышения. В академическом регистре предпочтительнее более точный эквивалент «Besides that», что поддерживает плавность логического перехода.  \n   Штраф: −1 балл (регистровое снижение из-за смещения оттенка усиления).\n\n2. «Artificial intelligence is capable of predicting» → «Artificial intelligence help (focused) ing of development»\n   Существуют серьёзные нарушения в этой части. Вместо «capable of predicting» студент использовал фразу «help focused ing». Во‑первых, «help focused ing» – конструкция с грамматической ошибкой, отсутствует конечный глагол с правильной формой. Неясно, за чем должен следовать глагол. \n   \n   Оригинал передаёт точную модальность «is capable of» (способен). В переводе студент заменил модальность на «focused ing» (неправильно сформулированную конструкцию). Утрата конструкции возможности приводит к искажению логики и смыслового ряда.\n   \n   Штраф: −3 балла за изменение субъектно-объектных отношений и потерю модальности.\n\n3. «Its development» → «of development»\n   Пропущен притяжательный элемент «its». Это затрудняет ясность самого объекта прогноза. «Of development» звучит неполно. Следовало использовать «its development» (развитие ИИ или системы отвечает на вопрос, свой или чужой).\n   \n   Штраф: −1 балл за лексическую неточность.\n\n4. «Starting from the initial point» → «...involving applications of it»\n   Оригинальная фраза «starting from the initial point» конкретна и научна. Здесь отсутствует прямое соответствие в переводе. Замена фразы «involving applications of it» вводит дополнительный смысловой слой (вовлечение приложений), который отсутствует в исходнике. Неправильная терминологическая подмена.\n   \n   Штраф: −3 балла – замена научного термина (точность термина нарушена).\n\nИтог по переводу:  \n\nВсего за фрагмент: 10 баллов изначально.  \nПрименено штрафов: −3 (за изменение субъектного действия, утрату возможности) −1 (стилистическая неточность, регистровое снижение) −3 (замена терминологии и дополнительных смыслов).\n\nСуммарный итог: 3 балла.\n\nЗаключение: Перевод утратил ключевой смысловый контекст и терминологическую точность. Требуется более тщательная работа с грамматической конструкцией, сохранением модальности (способности/intention) и соответствующей докладному формату терминологии («initial point» заменён некорректно). Перевод требует существенного улучшения.\n\nРекомендации:\n– Работать над точной передачей модальности («is capable of») в пассивной форме.\n– Сохранять структуру логики: «it» → «its development».\n– Избегать неполных формул, корректировать грамматические неточности.\n  \nИтоговый вывод: –3 балла, фрагмент отражает только частичное соответствие исходному сообщению.'}"
"Применимо к образовательному процессу, искусственный интеллект способен выявлять те или иные дисциплины в области этих дисциплин, в которых у обучающихся есть проблемы.
","{'out': 'Отправленная вами информация содержит перевод, произведённый студентом, и исходный текст на русском. Цель анализа: оценить уровень соответствия перевода звучанию, смыслу оригинала и точности использования лексики.\n\nИсходный текст (на русском):\n«Применимо к образовательному процессу, искусственный интеллект способен выявлять те или иные дисциплины в области этих дисциплин, в которых у обучающихся есть проблемы.»\n\nОтдельный анализ элементов исходного текста:\n1. «Применимо к образовательному процессу» — вводная фраза, обозначающая контекст.\n2. «Искусственный интеллект способен выявлять» — конструкция, подчёркивающая дееспособность ИИ (способности выявлять).\n3. «Иные дисциплины в области этих дисциплин» — тавтология, указывает на необходимость тщательного выделения предметных областей.\n4. «У обучающихся есть проблемы» — ключевой научный аспект: обнаружение проблемной зоны у обучающихся.\n\nПеревод (аудио):\n«Also, artificial intelligence can improve effectiveness of learning and in ares or in artificial ase, and so on.»\n\nОценка по критериям:\n\n1. «Also, artificial intelligence can improve effectiveness of learning» — начало перевода добавляет «also», что не было в исходнике. Это формирует частичное смещение контекстуальной нагрузки. Теряется основная вводная конструкция («применимо к образовательному процессу»), что создаёт ослабление научной специфики.\n   Ошибка: −1 балл (отсутствие указания на контекст образовательного процесса).\n   \n2. «… и в ares or in artificial ase» — явная ошибка (дисциплины не названы), неподобающая компрессия. Вероятно ошибочная попытка передачи слова «areas» (области). Это серьёзно искажающая абстракции ошибка и влияет на смысловую нагрузку.\n   Ошибка: −3 балла (полное искажение научного смысла: нет ни указаний на дисциплины, ни конкретизации областей выявления проблем). \n\n3. «And so on» — добавление неформальной конструкции неуместно в академическом контексте. Это снижает регистр, ослабляет аргументацию. \n   Ошибка: −2 балла (ослабление научной аргументации).\n\nИтоговая оценка:\n\nНачало реплики: 10 баллов.\nШтраф за искажение наук. смысла (изменение субъектно-объектных отношений): №2 (−3 балла). \nШтраф за ослабление аргументации в конце: №3 (−2 балла).\nШтраф за изменение структурного компонента для регистрирования значения: №1 (−1 балл).\n\nИтог: 10 - 3 - 2 - 1 = 4 балла.\n\nКомментарий: Студенту необходимо усилить внимание к контексту (начальная конструкция «Применимо к образовательному процессу»), точнее раскрывать терминологию в соответствии с оригиналом. Необходимо избегать грамматических и терминологических ошибок, сохранять строгий академический стиль. Точный перевод терминов («areas» — области) должен быть обеспечен, отвергать использование «and so on» в научном дискурсе без дальнейшего уточнения.'}"
