original,answer
"Еще одну проблему современного образования можно решать с помощью нейросети – это профориентация.
","{'out': 'Экспертный отчёт по анализу перевода:\n\nИсходный текст (оригинал):  \n«Еще одну проблему современного образования можно решать с помощью нейросети – это профориентация.»\n\nАудио-перевод студента:  \n«Also one problem which could be analyzed with artificial intelligence is personalization of learning.»\n\n1. Сопоставление с исходным текстом:  \n   Студент изменил исходную научную концепцию. Исходник касался профориентации, т.е. выбора дальнейшего профессионального пути, тогда как перевод сосредоточен на персонализации обучения. Это радикальное изменение предмета делает перевод невозможным к принятию – смысл и акцент существенно искажены.\n\n   Существуют следующие краткие замечания:  \n   – «Профориентация» по определению связано с выбором профессии, карьерного пути. «Персонализация обучения» – иная образовательная задача.  \n   – «Профориентация» относится к консультационным и аналитическим аспектам, а «персонализация обучения» — к адаптивным методологиям. Значение и научная терминология совпадают лишь частично.\n\n2. Субъектно-объектные отношения:  \n   Студент не сохранил оригинальную логику. В исходном варианте подразумевалось решение проблемы через нейросеть. В переводе указано, что «персонализация» предполагается как объект анализа. Точность субъектно-объектных отношений нарушена.\n\n3. Причинно-следственные связи:  \n   В исходнике «можно решать» является предположительной формой (can be solved), а в переводе присутствует «is personalization», что делает высказывание неприменимым к логике (проблема решается, а не анализируется).\n\n4. Терминологическая точность:  \n   «Профориентация» переведена весьма некорректно. «Personalization of learning» (персонализация обучения) не соответствует термину, так как слово «personalization» в данном контексте лексически непредпочтительно.\n\n5. Грамматические ошибки:  \n   В целом грамматика переводной конструкции корректна.\n\n6. Сохранение академического регистра:  \n   Формулировка «analyzed with artificial intelligence» недостаточно высока по регистру для научной конференции. В оригинале стоит «решать с помощью», что менее специализировано по технической точности, но не так сильно снижает регистр.\n\nОценка: \n\n1. Искажение смысла: −3  \n   Причина: Полное изменение объекта перевода – от профориентации к персонализации обучения.\n   \n2. Изменение субъектно-объектных отношений: −3  \n   Причина: Изменение предмета действия (связь нейросети с профориентацией заменена на анализ персонализации обучения).\n   \n3. Грамматическая ошибка: 0  \n   Причинно-следственные связи нарушены, но грамматически перевод корректен.\n   \n4. Терминологическая ошибка: −3  \n   Причина: Неправильно подобран эквивалент англоязычному профессиональному термину.\n\nИтоговый балл за реплику: 10 − 3 − 3 − 3 = 1'}"
"В заключении важно отметить, что использование искусственного интеллекта может привести к значительному улучшению эффективности обучения, формированию цифровой культуры обучающихся и позволит персонализировать процесс обучения.
","{'out': 'Экспертный анализ:\n\n1. Исходная реплика:  \n«В заключении важно отметить, что использование искусственного интеллекта может привести к значительному улучшению эффективности обучения, формированию цифровой культуры обучающихся и позволит персонализировать процесс обучения.»\n\n2. Перевод студента:  \n«А – To conclude, we can say that artificial intelligence can help people to... forming its personality and ... help to improve our skills.»\n\nАнализ ошибок:\n\n1. Полное искажение: \n– «Формирование цифровой культуры обучающихся» в исходнике важно, но в переводе отсутствует этот аспект. Переводчик не отразил концепцию цифровой культуры.\n−3 балла\n\n2. Частичное искажение:\n– «Повышение эффективности обучения» переведено как «to improve our skills» и «help to improve our skills», но это более общее утверждение. Исчезла терминология именно «эффективность обучения». Это снижает научную точность.\n−2 балла\n\n3. Неправильная структура: \n– «...can help people to... forming» – грамматически неверный вариант инфинитива. Верный вариант: «...can help people to form» или «...can help with forming». В исходнике нет «формирования личности» – искажение смысла.\n−3 балла\n\n4. Стилистические ошибки: \n– «...help to improve» – неестественная структура (не соответствующая академическому регистру). Правильнее было «help improve» или «facilitate improvement». \n−1 балл\n\nИтого по реплике:\n\n−3 (искажение)  \n−2 (оттенок значения)  \n−3 (грамматика)  \n−1 (стилистика)\n\nИтоговая оценка за реплику: 1 балл. \n\nРекомендация: Необходимо проработать точность терминологии, отработать грамматические конструкции, и уделить внимание различию в оттенках значений («эффективности обучения» и «улучшение навыков»).'}"
"Спасибо за внимание. Буду рад ответить на Ваши вопросы.
","{'out': 'Анализ аудиоперевода:\n\n1. Исходный текст: ""Спасибо за внимание. Буду рад ответить на Ваши вопросы.""\n   \n   Перевод: ""Thanks for your attention and I will glad to answer to your questions.""\n\n2. Оценка:\n\nОсновной анализ:\n- Терминологическая точность отсутствует.\n- Отделение ""опыт"" благодарственного коллокации ""Thanks for your attention"" верное. Оценка: 0.\n  \n- Сбалансированность конструкции ""I will glad"" нарушена грамматически: должно быть ""I will be glad"" (пропущена вспомогательная частица ""be"").\n  Нарушение грамматики. Штраф: −1 балл.\n\n- Фраза ""answer to your questions"" нетерминологически корректна. Правильное употребление: ""answer your questions"", без ""to"". Частичная искаженность. Штраф: −2 балла.\n\n- Структура фразы не ослабляет основную научную аргументацию. Штраф: отсутствует.\n\nИтого: \nБаллы: 10 (изначально) − 1 (грамматическая ошибка, ""will"" → ""will be"") − 2 (искажена конструкция ""answer to your questions"").\n\nИтоговый балл: 7. \n\nЭто демонстрирует, что перевод требует исправления в синтаксисе и грамматике. Основная идея сохранена, но не в полной мере с академической точностью.'}"
"How does artificial intelligence help solve the problem of the career guidance?
","{'out': 'Экспертный отчёт по результатам анализа перевода:\n\nИсходный текст (английский):  \n""How does artificial intelligence help solve the problem of the career guidance?""\n\nПеревод (аудио):  \n""Как искусственный интеллект может помочь для улучшения профориентации?""\n\nАнализ:\n\n1. Смысл:  \nВ целом, смысл передан. Исходная фраза указывает на помощь искусственного интеллекта в решении проблемы, в то время как переведённая версия уточняет аспект — улучшение профориентации. Смысл сохранён в достаточной мере, однако есть ряд нюансов. От первоначальной формулировки вопроса (про проблему в общем) сдвинут фокус на аспект улучшения, то есть услуга AI позиционируется не как решение глобальной проблемы, а как инструмент её улучшения. Это некоторое изменение.\n\n2. Субъектно-объектные отношения:  \nСубъект (искусственный интеллект) и его действие (помощь) грамматически корректно отражены в переводе. Здесь отношения соблюдены. Однако в исходном вопросе акцент на том, как (метод) решается проблема. Перевод акцентирует на том, как будет улучшено (то есть результат), что является частичным искажением мотива вопроса.\n\n3. Лексика и терминология:  \nТерминология предполагает наличие точности. Исходный термин “career guidance” в переводе представлен как “профориентация”. С лингвистической точки зрения это адекватная замена (профессиональная ориентация), однако в контексте научной дискуссии возможна большая специфичность — “career guidance” может подразумевать более широкий спектр вопросов (наставничество, карьерные треки, тестирование). В данном контексте термин не совсем точен. В идеале следовало бы уточнить: “профессиональное консультирование и руководство” или “вопросы карьерного ориентирования”.\n\n4. Логика:  \nНаблюдается слабая логическая передача: “помочь для улучшения” не идеально соответствует исходному “help solve”. Предлог для в данном контексте нетипичен. Непосредственное соответствие: “помочь в решении” было бы точнее. В текущей формулировке теряется часть исходной связки причины и решения, хотя смысл можно предположить сохранённым.\n\n5. Штрафные баллы:  \n−2 балла: Изменён оттенок — вместо решения проблемы сделан акцент на улучшении профориентации.\n−2 балла: Снижение точности терминологии — “профориентация” вместо возможного вариант “career counselling” или “career guidance”.\n−1 балл: Предлог “Для” заменяет конструкцию “help solve” (не точное соответствие предлогов действия).\n\nОкончательный балл за реплику:  \n10 − 2 − 2 − 1 = 5 баллов. \n\nКомментарий: перевод близок, однако имеется искажение в оттенке смысла и некоторая неточность с термином. Рекомендуется уделить большее внимание точности терминологии и логике формулировки.'}"
"Спасибо за вопрос. Искусственный интеллект анализирует ответы на вопросы по профориентации, составленные специалистами в этой области. Результатом анализа является детальная картина способностей и интересов человека.
","{'out': 'Анализ перевода:\n\nИсходный текст: \n""Спасибо за вопрос. Искусственный интеллект анализирует ответы на вопросы по профориентации, составленные специалистами в этой области. Результатом анализа является детальная картина способностей и интересов человека.""\n\nПеревод студента:\n""Thank you for your question. Artificial Intelligence helps to us to our professionation to improve our skills.""\n\nАнализ по критериям:\n\n1. От постановки задачи и идентификации исходного контекста.\nОценка: 10 баллов  \nКомментарий: Начало реплики в целом сохранено («Thank you for your question» полностью соответствует исходной фразе).\n\n2. Структура логики и точность передачи смысла.\nОценка: −3 балла  \nУточнение: Основное нарушение заключается в искажении сути. В исходнике «Искусственный интеллект анализирует ответы на вопросы по профориентации» студент передает: «Artificial Intelligence helps to us... to our professionation». В данном случае «analyzes answers to career-oriented questions by specialists» не передано. Вместо анализа ответов студент вводит «helps to us» (неверное дополнение ресурса) и меняет направление действия на помощь, а не анализ. Это искажение значения процесса и смещения субъектно-объектных отношений.\n\n3. Терминологическая точность.\nОценка: −2 балла  \nУточнение: Представлена попытка использовать слово с похожим значением («professionation»). В исходном фрагменте речь идет о «профориентации» (career guidance), а не о связанном термине. Заменяющий термин не соответствует наиболее общепринятой терминологии и ослабляет научную корректность.\n\n4. Модальность.\nОценка: 0 баллов  \nКомментарий: Модальность («analyzes» в исходном) была переведена как «helps to us». В данном случае модальность утрачена: исходная структура подразумевает анализ, а не помощь. Штраф, однако, уже применен выше, поэтому повторный扣 только за одно искажение.\n\n5. Лексическая точность.\nОценка: 0 баллов  \nКомментарий: В переводе присутствуют лексические неточности («profination» – методологически неудачное слово, которое с научной точки зрения здесь неточно), но значительной утраты смысла не произошло, хотя оттенки смысла и были ослаблены.\n\n6. Грамматические ошибки, которые не искажают смысл. Учтены:\n−1 балл  \nУточнение: Форма «helps to us» – грамматически некорректно. Правильнее «helps us». Пропущена грамматическая форма перед дополнением.\n\nИтоговый подсчет по реплике: \nНачальная база: 10 баллов\n−3 балла (искажение смыслового порядка, изменение субъектно-объектных связей)\n−2 балла (замена терминологии)\n−1 балл (грамматическая ошибка)\n\nИтог: 4 балла.\n\nКомментарий для преподавателя: При анализе перевода отмечены серьезные нарушения в ключевых терминах и переносе значений. Рекомендуется усилить внимание на адекватном переводе технических терминов, избегать неуместных неологизмов и уделять внимание сохранению субъект-на-предметной глубины смысловой связи.'}"
