original,answer
"Добрый день, уважаемые коллеги! Разрешите представить доклад на тему «Искусственный интеллект в образовании».
","{'out': 'Экспертный отчет по устному переводу: \n\nИсходный текст:  \n«Добрый день, уважаемые коллеги! Разрешите представить доклад на тему «Искусственный интеллект в образовании».»\n\nПеревод студента:  \n«Vraag: Dear Sirs/Madam, can you lead for me to speak about artificial intelligence in the education?»\n\nАнализ:\n\n1. Начальное приветствие:  \n   - «Добрый день, уважаемые коллеги» переведено как «Dear Sirs/Madam».  \n   - Глубокий смысл обращения «уважаемые коллеги» не учтён. Студент использует формальное обращение «Dear Sirs/Madam», но это не в полной мере отражает академическую доброжелательность и нейтральность в адресе к коллегам. Ошибка в точности использования обращений – смягчение исходного смысла.  \n   −2 балла за частичное изменение оттенка, снижение акцентальности приветствия.\n   \n2. Фраза «Разрешите представить доклад на тему...»:  \n   - В исходнике используется структура «Разрешите представить» (научная формула вежливого представления).  \n   - В переводе: «can you lead for me to speak» (можете ли вы позволить мне говорить) использована менее корректная формулировка, существующая проблема – замена глагольной конструкции на конструкцию с «can you lead». Фраза «lead for me» совершенно не точна.  \n   −3 балла: это полное искажение научного акцента на формальность и уважительность речи.  \n   \n3. Тема доклада:  \n   - «на тему «Искусственный интеллект в образовании»» переведено как «about artificial intelligence in the education».  \n   - Необходимое предлоговое согласование: «in the education» – некорректно. В английском языке используется «in education» без артикля.  \n   −1 балл за терминосвязь и грамматику (несоответствие: артикль и предлог).\n\nИтоговая оценка реплики:\n\n10 – 3 – 2 – 1 = 4 балла. \n\nОценка: 4 балла за первую реплику (из 10 возможных).\n\nОбщая рекомендация: студенту следует лучше уделить внимание тонкостям академической речи при переводе обращений и корректно использовать грамматические формы предлогов в контексте науки и образования. Важно также избегать кальки, характерные для разговорного английского.'}"
"Искусственный интеллект или машинное обучение на данный момент активно применяется в образовании, начиная от ведения и проверки экзаменов, заканчивая автоматическим подбором образовательного материала.
","{'out': 'Экспертный отчет по переводу (отметим, что исходная речь подавалась устно, оценка на B2–C1).\n\n1. Исходный текст: \n«Искусственный интеллект или машинное обучение на данный момент активно применяется в образовании, начиная от ведения и проверки экзаменов, заканчивая автоматическим подбором образовательного материала.»\n\n2. Перевод студента:\n«Artificial intelligence or automatic education bring a great role in the education, start with conducting an analysis of exams and to...»\n\nАнализ перевода направления (с английского на русский):\n- Смысл: В целом, студент постарался передать идею о том, что искусственный интеллект играет большую роль в образовании, но имеются значительные искажения.\n  \n−3 балла: \n1.Полное искажение научного смысла: \n      - Сектор ""automatic education"" неверно переведено. Исходник использует термин ""машинное обучение"" (machine learning), а это совсем иной термин. Это искажение термина.\n      - “Bring a great role” в английском звучит как ошибка исходного шага: в современной научной речи ожидается «play a significant role», а не «bring».\n      - Конструкция «and automatic подбор» изменена: исходник говорит о подборе образовательного материала, а студент остановился на «анализе экзаменов», то есть не завершено.\n      - «Start with conducting and analysis of exams» – в исходном тексте «начиная от» и «заканчивая» – это две части. Частью, связанной с аналитикой экзаменов, придержано начало, но окончание (по поводу автоматического подбора материала) отсутствует в переводе.\n      - Пропущена фраза «заканчивая автоматическим подбором образовательного материала».\n\n−2 балла:\n1. Лексическая неточность: \n      - «Automatic education» – неверный термин.\n      - Следует было использовать «machine learning» в соответствии с исходным текстом.\n      - “Bring a great role” – неверно передана предлоговая и лексическая конструкция в научной речи: «play a significant role» было бы точнее.\n\n−1 балл:\n1. Структурные неточности по порядку предложений (частичная рассогласованность времени): ошибка в формулировке «start with conducting… and to…» простая грамматическая ошибка (ненужный артикль, несогласование, отсутствие логического завершения)— снижает регистр обоснованности.\n\nИтого штрафных баллов на одну фразу: \n−3 (основная верификация: искажение тематики, терминологии, отсутствия заключающих фраз) — +1 (конструкционные неясности) = −3.\n\nМинимальный балл за реплику – 0.\n\nБаллы за реплику: 10 − 3 = 7\n\nАнализ перевода направления (с русского на английский):\n- Переведено неверно термино-модель: \n1. «Искусственный интеллект или машинное обучение» – не переведено в точности (incorrect transfer of terminology: “automatic education” instead of “machine learning”).\n2. «на данный момент» – не точно отражено словосочетанием, присутствие в времени было бы уместно (на это не было уместного внимания).\n3. Содержательные нюансы (от «начиная от ведения и проверки» к «conducting an analysis of exams» – это частичный перевод без продолжения, без «подбор материала»).\n\nИтого: \nБаллы за переречённый смысл: 10 − 3 = 7\n\nБаллы в сумме той же — 7. \n\nВывод:\nПеревод содержит критические терминологические и смысловые искажения. Рекомендуется обратить внимание на сохранение исходного порядка речевой аргументации, точности трактовки терминов (искусственный интеллект, машинное обучение), а также завершения смысловой цепочки.'}"
"Предлагаю обучающемуся более сознательно вникнуть в тему, повысить уровень знаний и способностей, анализируя успеваемость и производительность обучающегося, корректировать его план обучения.
","{'out': 'Экспертный отчёт:\n\n1. Анализ исходного смысла:\nИсходный текст: «Предлагаю обучающемуся более сознательно вникнуть в тему, повысить уровень знаний и способностей, анализируя успеваемость и производительность обучающегося, корректировать его план обучения.»\n\n2. Оригинальность и точность передачи направления:\nПеревод: «I suppose for students to involve in the report more consciously to analyze and identify education programs.»\n\n3. Оценка точности:\n−3 балла: полностью искажён научный смысл (например, «вникнуть в тему» и «повысить уровень знаний» не выражены в переводе, заменено словом «involve» и «report», что не соответствует исходной задаче; «успеваемость» и «производительность» отсутствуют в переводе, также не отражена коррекция плана обучения).\n−2 балла: частичное искажение смысла (несмотря на попытку передать «анализировать» и «осознанность», теряется связь между концепциями, такими как «успеваемость» и «производительность»; неверно выражена конечная функция — корректировка плана обучения).\n−1 балл: нет. Не отмечено в переводе.\n\n4. Лексика и терминология:\nЗначительно нарушено применение ключевых научных терминов. «Involve» (вовлекаться) стоит отдельно от «analyze» (анализировать). Современные или специализированные термины, такие как «успеваемость» (performance/academic performance) и «план обучения» (learning plan), полностью пропущены. «Identify education programs» (определить образовательные программы) — серьезный отход от темы улучшения уровня знаний конкретного студента.\n\nИтог:\n−2 балла: имеются частичные искажения смысла (не отражены существенные концепции: анализ успеваемости, производительности, корректировка плана обучения).\n−3 балла: отсутствует адекватный академический стиль (например, «I suppose» снижает регистр и точность).\nИтого: 5 баллов.\n\nМинивысновок: Перевод усложнен и требует корректировки с точкой сохранения предметного контекста (анализ успеваемости, улучшение знаний, корректировка учебного плана). \n\nВозможные корректировки:\n«It’s suggested that students engage more consciously with the topic by increasing their knowledge and skills, analyzing the outcomes and performance, and adjusting their learning plan accordingly.»'}"
"Рассмотрим основные направления использования искусственного интеллекта в образовании на данный момент.
","{'out': 'Аналитический отчёт по переводу:\n\nИсходный текст: «Рассмотрим основные направления использования искусственного интеллекта в образовании на данный момент.»\n\nПеревод: «Let us see the basic applications in the education, in education right now.»\n\n1. Смысловая точность: \n   Смысл в целом передан, переводчик выбрал подходящую фразу «basic applications» (основные направления), что соответствует «основные направления использования». Однако перефразировка «basic applications» вместо «искусственного интеллекта» упрощает формулировку, теряется холистический взгляд (не сказано о контексте AI). \n   −2 балла за некоторое ослабление научного смысла и изменение акцентов: ухудшено восприятие того, что AI — это главная тема. Упущен ключевой термин «искусственный интеллект».\n\n2. Терминологическая точность:\n   Исходный текст сосредоточен на «искусственном интеллекте», однако «AI» не был явно указан в переводе. «Applications» и «directions» — корректные исследования, но ключевой термин «искусственный интеллект» нужно было включить в перевод.\n   −3 балла за серьёзное упущение термина «искусственный интеллект».\n\n3. Модальность и конструкции:\n   Использование «Let us see» менее формально и академически, чем исходная форма «Рассмотрим». Модальность weakened: «Let us see» (сделать акцент на обозрительном характере) меняет акцент структуры от анализа к демонстрации.\n   −2 балла за изменение оттенка выразительности и ослабление научной аргументации.\n\n4. Грамматическая точность:\n   Повтор «in education» звучит вставочно, что стилистически снижает качество фразы. «In the education» — артикль «the» лишний, а повторение самого «in education» звучит тавтологично.\n   −1 балл за стилистическую неточность и регистровый сбой.\n\nИтоговая оценка: \nИсходная реплика: 10 баллов  \nШтрафы: −3 (терминология), −2 (оттенок смысла), −1 (повтор/артикль), −2 (оторвался от академической формальности)\n\nИтог: 2 балла за реплику. \n\nКомментарий: Перевод нуждается в улучшении терминологической точности, корректном использовании жаргона и терминов искусственного интеллекта (AI), а также формальности подачи. Не стоит упрощать строй предложения.'}"
"Автоматизация рутинных задач, а именно контроль успеваемости, проверка типовых заданий и даже подготовка к занятиям. Для повышения эффективности и качества образования теперь представляется возможность деледировать подобную рутинную работу искусственному интеллекту.
","{'out': 'Экспертный отчет (анализ перевода):\n\nИсходная реплика:  \n«Автоматизация рутинных задач, а именно контроль успеваемости, проверка типовых заданий и даже подготовка к занятиям. Для повышения эффективности и качества образования теперь представляется возможность делегировать подобную рутинную работу искусственному интеллекту.»\n\nПеревод студента (аудио):  \n«Automating rote tasks and preparation for them can lead a great role nowadays. We can see...»\n\nОценка:\n\n1. Первая реплика (10 баллов). Оценим искажений или точность:\n   – «Automating rote tasks» — соответствие терминологии: «автоматизация рутинных задач» было передано, но термин «routine tasks» употреблён как «rote tasks», что является неточным перефразом (хотя и возможно стилистически допустим в некоторых контекстах). Присутствует неточность лексического оттенка (rote имеет более ограниченный смысл — скорее «механическое выполнение»).\n   \n   −1 балл (несущественная лексическая неточность: «rote» vs «routine»).\n\n2. Следом: «preparation for them» — отсутствовало слово «подготовка к занятиям» как отдельный элемент перечисления. Это приводит к неполному сохранению смысла — потерен ключевой аспект исходной аргументации о нескольких типах задач.\n\n   −3 балла (полное искажение научного смысла: отсутствие «контроль успеваемости» и «проверка типовых заданий», а также пропущенная часть — «подготовка к занятиям»).\n\n3. Далее «can lead a great role»:\n   – В исходнике говорилось не о «lead a role», а о возможности делегирования рутинной работы (delegation/ delegation possibility). Здесь нарушена модальность (отсутствует «представляется возможность», то есть пассивность), что искажает исходную идею о делегировании процессу.\n   \n   −3 балла (серьёзное изменение модальности и семантики).\n\n4. Фраза «nowadays» — переведена верно с точки зрения времени, но пропущено важное уточнение про повышение «эффективности и качества образования» (об этом ничего не сказано в переводе).\n\n   −2 балла (частичное искажение аргументации: неясны цели автоматизации).\n\nИтог по первой реплике:\n10 – 1 – 3 – 3 – 2 = 1 балл.\n\nВывод о реплике в целом: перевод значительно искажает исходный смысл. Отдельные элементы (перечисление задач) выпали из перевода. Основная структурная ошибка — неточное отражение ответственности и модальности делегирования. Сохранение оттенков точности не выполнено.\n\nОценка в целом: 1 балл.\n\nРекомендуется обратить внимание на:\n– Точность лексики (routine vs rote).\n– Полное перечисление всех элементов исходного описания.\n– Придерживаться в переводе исходной модальности делегирования (использование конструкции «представляется возможность»).\n\nПредставленный перевод не полностью соответствует исходному тексту, имеются существенные отличия по терминологии. В следующей итерации важно включить все элементы в последовательный смысловой блок.'}"
